Title,Language,Year,Author,Publisher,Type,Pages,Summary,Activity
Sang Kancil dan Buaya,BM,2020,Pak Pandir,Pustaka Rakyat,Buku Fiksyen,24,Kisah kancil yang cerdik menyeberangi sungai.,Rumusan
The Adventure of Sherlock Holmes,BI,1892,Arthur Conan Doyle,George Newnes,Buku Fiksyen,307,A detective solving crimes.,Lain-lain
Sejarah Malaysia,BM,2015,Ahmad Bin Ali,Dewan Bahasa dan Pustaka,Buku Bukan Fiksyen,150,Sejarah pembentukan Malaysia.,Bercerita
Misteri Pulau Harapan,BM,2023,Azman Ismail,Pustaka Ilmu,Buku Fiksyen,120,Kisah sekumpulan remaja yang menemui rahsia di sebuah pulau terpencil yang penuh misteri.,Rumusan
Misteri Hutan Belantara,BM,2024,Siti Nurhaliza,Penerbit Muzik,Buku Fiksyen,150,Kisah pengembaraan seorang penyanyi di dalam hutan belantara yang penuh dengan cabaran dan rahsia alam.,Rumusan
